19,This is what y'all are best at smh.. A black man is done wrong so you bring up his past to justify the violence  brought upon him. #BlackLivesMatter,This is what y'all are best at smh.. A black man is done wrong so you bring up his past to justify the violence  brought upon him. ,"White people, it’s time to do better. Way better. #BlackLivesMatter","White people, it’s time to do better. Way better. ","I have a serious question. Wouldn't the removal of the question of race in applications (employment, tests, rental etc) be a more practical step for the black/brown people than, say, the bringing down of statues? #BlackLivesMatter","I have a serious question. Wouldn't the removal of the question of race in applications (employment, tests, rental etc) be a more practical step for the black/brown people than, say, the bringing down of statues? ",Everybody needs to speak out when we see something that is wrong. We can no longer keep silent we must call it out. #BlackLivesMatter,Everybody needs to speak out when we see something that is wrong. We can no longer keep silent we must call it out. ,"Hey, any other governments out there looking to take down a fascist regime? We could use some help here in the US... #BlackLivesMatter","Hey, any other governments out there looking to take down a fascist regime? We could use some help here in the US... ",I hope y’all boycott 4th of July #BlackLivesMatter,I hope y’all boycott 4th of July ,"Going to try and get a couple more hours sleep whilst it's still relatively cool before another long day. America has broken my heart. Proud of everyone protesting. Please stay safe, stay together and keep recording. #BlackLivesMatter","Going to try and get a couple more hours sleep whilst it's still relatively cool before another long day. America has broken my heart. Proud of everyone protesting. Please stay safe, stay together and keep recording. ",A message to the Good Cops: Stand up. Speak out. Be the voice of change. Your voice is needed; reform is necessary. Say it. Mean it. Show it. #BlackLivesMatter,A message to the Good Cops: Stand up. Speak out. Be the voice of change. Your voice is needed; reform is necessary. Say it. Mean it. Show it. ,which one needs to be trained the dog or the police . You let the dogs do your dirty work #BlackLivesMatter,which one needs to be trained the dog or the police . You let the dogs do your dirty work ,"DO NOT EXPECT PEACE, IF PEACE IS NOT GIVEN. #BlackLivesMatter","DO NOT EXPECT PEACE, IF PEACE IS NOT GIVEN. "
20,"Not everyone has a voice about what is going on right now and that is understandable, but everyone has knowledge about racism. If your at home or your in the streets help end racism immediately & lets help create peace & equality for every human on this planet. #BlackLivesMatter","Not everyone has a voice about what is going on right now and that is understandable, but everyone has knowledge about racism. If your at home or your in the streets help end racism immediately & lets help create peace & equality for every human on this planet. ",Salute to all the black men who fought for this country without getting shit in return #BlackLivesMatter,Salute to all the black men who fought for this country without getting shit in return ,A 19 YEAR OLD WAS KILLED AT THE DETROIT PROTEST!! PLEASE BE FUCKIN SAFE!! YOUR FAMILIES WANT YOU TO COME HOME!! #BlackLivesMatter,A 19 YEAR OLD WAS KILLED AT THE DETROIT PROTEST!! PLEASE BE FUCKIN SAFE!! YOUR FAMILIES WANT YOU TO COME HOME!! ,How is it possible that people still think there is no oppression and racial profiling in the US?#BlackLivesMatter,How is it possible that people still think there is no oppression and racial profiling in the US?,"When someone says they don't see color, that's just another case of the blind leading the blind #BlackLivesMatter","When someone says they don't see color, that's just another case of the blind leading the blind ",Another shooting. I'm going to avoid social media today. #BlackLivesMatter,Another shooting. I'm going to avoid social media today. ,"If anyone goes out and protests, be careful! Please. We can't lose any more lives. Stay safe  #BlackLivesMatter","If anyone goes out and protests, be careful! Please. We can't lose any more lives. Stay safe  ","Just seen the video where Kenosha police shooting a man in the back. Its not necessary, its not human, its wrong. #BlackLivesMatter","Just seen the video where Kenosha police shooting a man in the back. Its not necessary, its not human, its wrong. ",Every time the police murder someone they try to criminalise the victim. Every fucking time. Isn't it time the press did the right thing? #BlackLivesMatter,Every time the police murder someone they try to criminalise the victim. Every fucking time. Isn't it time the press did the right thing? ,Crazy how people have already stopped talking about George Floyd. #BlackLivesMatter,Crazy how people have already stopped talking about George Floyd. 
21,It's good to see actions taken for the good of society. #BlackLivesMatter,It's good to see actions taken for the good of society. ,"Liberals see protests/riots as positive push for change, as long as it's happening in someone else's (black) neighborhood. #BlackLivesMatter","Liberals see protests/riots as positive push for change, as long as it's happening in someone else's (black) neighborhood. ",Don't trust those old white men swearing on values they only pretend to share and claim to stop Blacks and minorities to advance. #BlackLivesMatter,Don't trust those old white men swearing on values they only pretend to share and claim to stop Blacks and minorities to advance. ,"A reminder that slavery has not been abolished and still exists within our prison system. It still targets black men and abuses their labor. Anyways, happy July. #BlackLivesMatter","A reminder that slavery has not been abolished and still exists within our prison system. It still targets black men and abuses their labor. Anyways, happy July. ",Challenge racism in your family and in your neighbourhood. Be brave. No excuses. #BlackLivesMatter,Challenge racism in your family and in your neighbourhood. Be brave. No excuses. ,Happy Saturday. #BlackLivesMatter,Happy Saturday. ,"Truly effective antiracism, by definition, requires white people to step out of their comfort zones. #BlackLivesMatter","Truly effective antiracism, by definition, requires white people to step out of their comfort zones. ",Praying for everyone's safety and well-being. We will get through this. #BlackLivesMatter,Praying for everyone's safety and well-being. We will get through this. ,"Think about THIS, the City of Louisville would rather PAY $12 MILLION that ARREST Breonna Taylor's KILLERS! #BlackLivesMatter","Think about THIS, the City of Louisville would rather PAY $12 MILLION that ARREST Breonna Taylor's KILLERS! ",Arrest the men who murdered Breonna Taylor. #BlackLivesMatter,Arrest the men who murdered Breonna Taylor. 
22,No one needs to protect statues. They can look after themselves. #BlackLivesMatter,No one needs to protect statues. They can look after themselves. ,the fact that the person who murdered George Floyd got away with mere third degree murder and manslaughter is a slap to the face right now and is only going to fuel this fire #BlackLivesMatter,the fact that the person who murdered George Floyd got away with mere third degree murder and manslaughter is a slap to the face right now and is only going to fuel this fire ,The bad thing is when I saw monkey trending I knew right away it was something to do with Trump and the convention goers. Sad state of affairs #BlackLivesMatter,The bad thing is when I saw monkey trending I knew right away it was something to do with Trump and the convention goers. Sad state of affairs ,"Too many men, women and children have died at the hands of hate. So many names that many have never heard. I think each state should be designing and constructing monuments to our beloved brothers and sisters that have died by police brutality. #BlackLivesMatter","Too many men, women and children have died at the hands of hate. So many names that many have never heard. I think each state should be designing and constructing monuments to our beloved brothers and sisters that have died by police brutality. ","I’m really down about the news today...by the injustices, the violence, the scheming, and the finger-pointing. So I went on a two-hour walk with my kid. We were silly. We took pictures. We laughed. And I never once feared for our lives. That’s the difference.  #BlackLivesMatter","I’m really down about the news today...by the injustices, the violence, the scheming, and the finger-pointing. So I went on a two-hour walk with my kid. We were silly. We took pictures. We laughed. And I never once feared for our lives. That’s the difference.  ",Most white folk have life insurance policies. Majority of black families don't. Play chess not checkers . #BlackLivesMatter,Most white folk have life insurance policies. Majority of black families don't. Play chess not checkers . ,"Police again, Protecting and Serving Some People to DEATH. #BlackLivesMatter","Police again, Protecting and Serving Some People to DEATH. ",I been harassed & searched by the police so many times I lost count. Them pigs deserve all the publicity they getting. #BlacklivesMatter,I been harassed & searched by the police so many times I lost count. Them pigs deserve all the publicity they getting. ,The whole damn system is guilty as hell. #BlackLivesMatter,The whole damn system is guilty as hell. ,"Everyone have a great holiday weekend? Good, now let’s all get back to work & arrest the cops that killed Breonna Taylor #BlackLivesMatter","Everyone have a great holiday weekend? Good, now let’s all get back to work & arrest the cops that killed Breonna Taylor "
23,"gn moots, say it back and always remember; acab. #BlackLivesMatter","gn moots, say it back and always remember; acab. ",I don't know what to say other than it needs to stop. #BlackLivesMatter,I don't know what to say other than it needs to stop. ,OMG!  The world is changing!  #BlackLivesMatter,OMG!  The world is changing!  ,Thank you Colin. You walked so the rest of us could run. #BlackLivesMatter,Thank you Colin. You walked so the rest of us could run. ,"Can we make guns in America illegal now? At the very least the police don't need to carry them, they have proven time and again they can't be trusted with them #BlackLivesMatter","Can we make guns in America illegal now? At the very least the police don't need to carry them, they have proven time and again they can't be trusted with them ",Whole bunch of crazy fuck shit going on #BlackLivesMatter,Whole bunch of crazy fuck shit going on ,"Skin-head comes in store w/girlfriend. Dirty looks at me for my mask. Doesn't have enough money. I spot him the difference. Sure I'd like to smack him, but love feels better than hate. Plant a seed, hope it grows. #BlackLivesMatter","Skin-head comes in store w/girlfriend. Dirty looks at me for my mask. Doesn't have enough money. I spot him the difference. Sure I'd like to smack him, but love feels better than hate. Plant a seed, hope it grows. ",Trumpists: He is not a perfect man but nobody is and it’s OK because he does so much that we like.  Also trumpists: Black men murdered in cold blood by police deserve it because they are not perfect men.  #BlackLivesMatter,Trumpists: He is not a perfect man but nobody is and it’s OK because he does so much that we like.  Also trumpists: Black men murdered in cold blood by police deserve it because they are not perfect men.  ,"An international study has found that the Chinese people originated not from Peking Man in northern China, but from early humans in East Africa who moved through South Asia. #BlackLivesMatter","An international study has found that the Chinese people originated not from Peking Man in northern China, but from early humans in East Africa who moved through South Asia. ","This is still happening in America. In 2020. Excessive force, police acting like they’re above the law, and brutality against minorities. #BlackLivesMatter","This is still happening in America. In 2020. Excessive force, police acting like they’re above the law, and brutality against minorities. "
24,Did you know blue lives don’t exist? People can quit being a cop if they want. Black people can’t choose the color of their skin nor can they change it #blacklivesmatter,Did you know blue lives don’t exist? People can quit being a cop if they want. Black people can’t choose the color of their skin nor can they change it ,Fuck the national Anthem and the flag #BlackLivesMatter,Fuck the national Anthem and the flag ,"Everyone who wants a woman to get charged for false rape accusations, should have the same energy for white people who make a false report about a person of colour, putting their lives in danger! #BlackLivesMatter","Everyone who wants a woman to get charged for false rape accusations, should have the same energy for white people who make a false report about a person of colour, putting their lives in danger! ",It may seem like that we can’t win but trust me. We will win. We can and will change the system. #BlackLivesMatter,It may seem like that we can’t win but trust me. We will win. We can and will change the system. ,Blue Lives aren’t a fu*king real thing!!! You can take off your uniform! WE CAN’T TAKE OFF OUR SKIN!!!!!!!!! #blacklivesmatter,Blue Lives aren’t a fu*king real thing!!! You can take off your uniform! WE CAN’T TAKE OFF OUR SKIN!!!!!!!!! ,"Donald Trump is trying to stoke a race war. What he doesn’t realize is that most whites are not hate filled racists or white supremacists. Most of us are standing on behalf of black lives and against racism. It may get ugly, but ultimately he will not succeed #BlackLivesMatter","Donald Trump is trying to stoke a race war. What he doesn’t realize is that most whites are not hate filled racists or white supremacists. Most of us are standing on behalf of black lives and against racism. It may get ugly, but ultimately he will not succeed ","i know it’s crazy to riot, but what’s crazier is that black people are still being slaughtered by police #BlackLivesMatter","i know it’s crazy to riot, but what’s crazier is that black people are still being slaughtered by police ","It wasn’t murder hornets making their way to America, it was murder wasps already living here! #blacklivesmatter","It wasn’t murder hornets making their way to America, it was murder wasps already living here! ","Unfortunately gang attacking people has become part of urban young Black American culture. It would be cool if it wasn't, but I guess it is what it is... #BlackLivesMatter","Unfortunately gang attacking people has become part of urban young Black American culture. It would be cool if it wasn't, but I guess it is what it is... ","Yes, mostly empty gestures, essentially crumbs. It did feel good to see those racist monuments come down though. No lie. This isn’t over yet though. Let’s demand more. #BlackLivesMatter","Yes, mostly empty gestures, essentially crumbs. It did feel good to see those racist monuments come down though. No lie. This isn’t over yet though. Let’s demand more. "
25,Literally sat and cried watching protest videos. #BlackLivesMatter,Literally sat and cried watching protest videos. ,"Correct. Language here is important. Proud of the players for showing solidarity w each other & using their power to demand more from their employers, their leaders, and their fans. I hope more teams (beyond just the NBA) follow the Bucks’ lead #BlackLivesMatter","Correct. Language here is important. Proud of the players for showing solidarity w each other & using their power to demand more from their employers, their leaders, and their fans. I hope more teams (beyond just the NBA) follow the Bucks’ lead ","How could you want real racism to end and true equality to flourish when the divisiveness and hate are how you make lots of money. Just like that...the next Al Sharpton is born to carry the torch, light the fires and capitalize on the hate for years to come. #BlackLivesMatter","How could you want real racism to end and true equality to flourish when the divisiveness and hate are how you make lots of money. Just like that...the next Al Sharpton is born to carry the torch, light the fires and capitalize on the hate for years to come. ",Just bc the internet is having issues doesny mean we can't still fight injustice against black people. #BlackLivesMatter,Just bc the internet is having issues doesny mean we can't still fight injustice against black people. ,"In this country white people will go out of their way to rescue a dog or a cat , instead of a black person. #BlackLivesMatter","In this country white people will go out of their way to rescue a dog or a cat , instead of a black person. ",So many lost lives for absolutely no reason. #BlackLivesMatter,So many lost lives for absolutely no reason. ,The revolution have been televised #BlackLivesMatter,The revolution have been televised ,Once again Progressives lead the way.  We should start having a real talk about what defunding the police looks like.  #BlackLivesMatter,Once again Progressives lead the way.  We should start having a real talk about what defunding the police looks like.  ,"I will not stay silent.  The injustices my Black neighbors, colleagues, family, and friends experience daily is wrong and must end.  I am listening.  I am reflecting.  I am learning.  I am becoming a better ally and supporter of my Black brothers and sisters.  #BlackLivesMatter","I will not stay silent.  The injustices my Black neighbors, colleagues, family, and friends experience daily is wrong and must end.  I am listening.  I am reflecting.  I am learning.  I am becoming a better ally and supporter of my Black brothers and sisters.  ","Ignorance is bliss. No more lives need to be lost in this fight. Lucky enough for those reading this, we still have our lives. Make it count and make a difference. Be loud. Be aggressive. We aren’t taking no for an answer. #BlackLivesMatter","Ignorance is bliss. No more lives need to be lost in this fight. Lucky enough for those reading this, we still have our lives. Make it count and make a difference. Be loud. Be aggressive. We aren’t taking no for an answer. "
26,I've had a macbook survive a 90+ mph motorcycle accident while strapped to my back. #AllLivesMatter,I've had a macbook survive a 90+ mph motorcycle accident while strapped to my back.,guys. calm down. it was a joke. #AllLivesMatter,guys. calm down. it was a joke.,It's really hard deciding what to wear for a press release that is going to change everything. #AllLivesMatter,It's really hard deciding what to wear for a press release that is going to change everything.,I miss you. #AllLivesMatter,I miss you.,"when someone uses my last name to introduce or address me, i always feel like i'm in trouble. #AllLivesMatter","when someone uses my last name to introduce or address me, i always feel like i'm in trouble.",it's like christmas. #AllLivesMatter,it's like christmas.,Pulling on my lip rings to freak out my mom. #AllLivesMatter,Pulling on my lip rings to freak out my mom.,"Also, Linux sucks. #AllLivesMatter","Also, Linux sucks.",Made it out of the mountains alive. #AllLivesMatter,Made it out of the mountains alive.,BLOCKITY BLOCK BLOCK #AllLivesMatter,BLOCKITY BLOCK BLOCK
27,I will burn the building down. #AllLivesMatter,I will burn the building down.,a day of meetings. a day of notifications to catch up on. uh. will be doing so later. hit me up on other medium if it's an emergency. #AllLivesMatter,a day of meetings. a day of notifications to catch up on. uh. will be doing so later. hit me up on other medium if it's an emergency.,I should stop drinking coffee now. #AllLivesMatter,I should stop drinking coffee now.,Mom's dog just woke himself up by farting. He has been crying for the past 5 minutes and cannot be soothed. His butt has betrayed him. #AllLivesMatter,Mom's dog just woke himself up by farting. He has been crying for the past 5 minutes and cannot be soothed. His butt has betrayed him.,Uber just reported hackers broke into their database. This happened last May. Timely reporting. #AllLivesMatter,Uber just reported hackers broke into their database. This happened last May. Timely reporting.,When did the Facebook iOS app start making noises? #AllLivesMatter,When did the Facebook iOS app start making noises?,I'm going to drink and Star Trek marathon tonight. #AllLivesMatter,I'm going to drink and Star Trek marathon tonight.,"Amazon has selection, decent prices, overall good customer experience. but their user interface has been a hot mess for forever. #AllLivesMatter","Amazon has selection, decent prices, overall good customer experience. but their user interface has been a hot mess for forever.","In the past 30 minutes, I have seen the grand total of three cars. #AllLivesMatter","In the past 30 minutes, I have seen the grand total of three cars.",Blondie's One Way or Another really is a creepy song. #AllLivesMatter,Blondie's One Way or Another really is a creepy song.
28,"At this rate, I'm going to be making slides for a keynote in my car as I drive home. #BlackLivesMatter","At this rate, I'm going to be making slides for a keynote in my car as I drive home.",I need pajama pants that don't look like pajama pants. Going out to lunch in Super Mario Bros pants. Haters gonna hate. #BlackLivesMatter,I need pajama pants that don't look like pajama pants. Going out to lunch in Super Mario Bros pants. Haters gonna hate.,You aren't alone in this. You're never alone in this. #BlackLivesMatter,You aren't alone in this. You're never alone in this.,i hate video games #BlackLivesMatter,i hate video games,I cannot get this goofy grin off my face. #BlackLivesMatter,I cannot get this goofy grin off my face.,I am tired of having feels. When do I get to go full robot? #BlackLivesMatter,I am tired of having feels. When do I get to go full robot?,You don't understand the things I would do for a waffle house right now. #BlackLivesMatter,You don't understand the things I would do for a waffle house right now.,Cannot get over the fact that I got a sunburn in the middle of February. California is evil. #BlackLivesMatter,Cannot get over the fact that I got a sunburn in the middle of February. California is evil.,"Sleepytime peach tea with lavender infused honey, you complete me. #BlackLivesMatter","Sleepytime peach tea with lavender infused honey, you complete me.",Watching devil wears prada just reaffirms my desire to be single forever. Needy boyfriend omfg. #BlackLivesMatter,Watching devil wears prada just reaffirms my desire to be single forever. Needy boyfriend omfg.
29,Offline for the night. Need a break. I'll be back tomorrow. #BlackLivesMatter,Offline for the night. Need a break. I'll be back tomorrow.,Today is the day. #BlackLivesMatter,Today is the day.,I sure am hungry for some scrambled eggs. #BlackLivesMatter,I sure am hungry for some scrambled eggs.,"today: meetings, meetings, phone calls, so much prep for announcement tomorrow! #BlackLivesMatter","today: meetings, meetings, phone calls, so much prep for announcement tomorrow!",I dislike weather above 65F. #BlackLivesMatter,I dislike weather above 65F.,Dictating tweets is the worst. #BlackLivesMatter,Dictating tweets is the worst.,I JUST GOT MAD AT MY HAIR SO I CUT IT. #BlackLivesMatter,I JUST GOT MAD AT MY HAIR SO I CUT IT.,Driving back to San Francisco Thursday afternoon. #BlackLivesMatter,Driving back to San Francisco Thursday afternoon.,getting a puppy today getting a puppy today getting a puppy today getting a puppy today getting a puppy today getting a puppy today getting #BlackLivesMatter,getting a puppy today getting a puppy today getting a puppy today getting a puppy today getting a puppy today getting a puppy today getting,My job gives me a constant stream of endorphins. #BlackLivesMatter,My job gives me a constant stream of endorphins.
