9,Hooligans and criminals #Alllivesmatter,Hooligans and criminals ,"So, my question would be what is the black community doing for itself, first?  Are their neighborhoods clean? Are they self-policing and keeping their neighborhoods safe? Are they always concerned about their children and their whereabouts? #AllLivesMatter","So, my question would be what is the black community doing for itself, first?  Are their neighborhoods clean? Are they self-policing and keeping their neighborhoods safe? Are they always concerned about their children and their whereabouts? ",Let's not say anything about free speech! #AllLivesMatter,Let's not say anything about free speech! ,I am white male. I don't have a racist bone in my body. I love all people and don't care what color your skin is. But I refuse to take a knee and appolgize for being born white. #AllLivesMatter,I am white male. I don't have a racist bone in my body. I love all people and don't care what color your skin is. But I refuse to take a knee and appolgize for being born white. ,"Just remember that when the constitution was written, it was assumed to be for “ALL” Americans... don’t let that go over your head #AllLivesMatter","Just remember that when the constitution was written, it was assumed to be for “ALL” Americans... don’t let that go over your head ","We Are All Humans Until Race Disconnected Us, Religion Separated Us, Politics Divided Us And Wealth Classied Us  #AllLivesMatter","We Are All Humans Until Race Disconnected Us, Religion Separated Us, Politics Divided Us And Wealth Classied Us  ",Holding historical figures to the standards we share today is simply asinine. #AllLivesMatter,Holding historical figures to the standards we share today is simply asinine. ,"honor and respect that there can be no permanent solution. So please stop this senseless violence. We aren't honoring anybody or getting any kind of justice like this. All that is happening is a futhering of hate, fear, and misunderstanding. #AllLivesMatter","honor and respect that there can be no permanent solution. So please stop this senseless violence. We aren't honoring anybody or getting any kind of justice like this. All that is happening is a futhering of hate, fear, and misunderstanding. ","Not all rioters are genuine, not all police are ruthless racists. Lack of fear for Law & Order will lead to a state of anarchy. #AllLivesMatter","Not all rioters are genuine, not all police are ruthless racists. Lack of fear for Law & Order will lead to a state of anarchy. ",White guilt is a self inflicted poison... Those inflicted with white guilt are secret racists... #AllLivesMatter,White guilt is a self inflicted poison... Those inflicted with white guilt are secret racists... 
10,Spread love not hate. #AllLivesMatter,Spread love not hate. ,The new thing is beating up White people and filming it. So brave. So woke. #AllLivesMatter,The new thing is beating up White people and filming it. So brave. So woke. ,"But you can loot, takeover streets, start fires, attack police and not get arrested.  #ALLLIVESMATTER","But you can loot, takeover streets, start fires, attack police and not get arrested.  ","I’m with these safe and sensible cities. It’s painful, but possible to recover from economic hardship. That’s not the case with death. #AllLivesMatter","I’m with these safe and sensible cities. It’s painful, but possible to recover from economic hardship. That’s not the case with death. ","If you are wondering where the madness comes from - look to your universities and increasingly your high schools, middle schools and elementary schools. There was a time when we taught kids the 3 R's. Nowadays we're teaching them to hate the USA. #AllLivesMatter","If you are wondering where the madness comes from - look to your universities and increasingly your high schools, middle schools and elementary schools. There was a time when we taught kids the 3 R's. Nowadays we're teaching them to hate the USA. ",The message is lost when people started attacking private business unfortunately #AllLivesMatter,The message is lost when people started attacking private business unfortunately ,"As an Hispanic, I’ve felt too the racism at one point in my 27 years living in USA.  You have a voice, use it.  No one is above you just because of their skin color.  We ALL matter.  We ALL deserve the right to a decent life #AllLivesMatter","As an Hispanic, I’ve felt too the racism at one point in my 27 years living in USA.  You have a voice, use it.  No one is above you just because of their skin color.  We ALL matter.  We ALL deserve the right to a decent life ",Since when are celebrity (has beens) COVID-19 deaths more important than the deaths of anyone else?  #alllivesmatter,Since when are celebrity (has beens) COVID-19 deaths more important than the deaths of anyone else?  ,There's beauty in every shade. #AllLivesMatter,There's beauty in every shade. ,The left and their push for infanticide.  These people are sick.  #AllLivesMatter,The left and their push for infanticide.  These people are sick.  
11,Really believe a lot of good people of all races are quiet. Unless you all speak up nothing will change... why is there so much injustice #AllLivesMatter,Really believe a lot of good people of all races are quiet. Unless you all speak up nothing will change... why is there so much injustice ,"When will our governments stop playing ""doctor doctor"" and start playing ""governance governance"" ? #alllivesmatter","When will our governments stop playing ""doctor doctor"" and start playing ""governance governance"" ? ",Again with no provocation lives are destroyed and we await justice for them #AllLivesMatter,Again with no provocation lives are destroyed and we await justice for them ,The concept of US society and US constitution hasn't worked well for a single day since 4th July 1776. #AllLivesMatter,The concept of US society and US constitution hasn't worked well for a single day since 4th July 1776. ,Civilization is more than just rocks tricked into thinking and doing. #AllLivesMatter,Civilization is more than just rocks tricked into thinking and doing. ,Don’t let the racists in the protests tarnish your heart.  They are playing a game of divide and conquer. Expose their lies and hypocrisy. #alllivesmatter,Don’t let the racists in the protests tarnish your heart.  They are playing a game of divide and conquer. Expose their lies and hypocrisy. ,"How many deaths does it take to stop what seems to be a race war? This all started, by what seems to be a racist police officer. This is no-one's fault, but THAT police officer. #AllLivesMatter","How many deaths does it take to stop what seems to be a race war? This all started, by what seems to be a racist police officer. This is no-one's fault, but THAT police officer. ","AOC wants to justify an infant being killed, by claiming the cause is someone needing a loaf of bread. I didn't see any looters walking out with loaves of bread, maybe the bread was hidden in the Louis Vuitton bag, or in a Nike shoe box they were carrying out #AllLivesMatter","AOC wants to justify an infant being killed, by claiming the cause is someone needing a loaf of bread. I didn't see any looters walking out with loaves of bread, maybe the bread was hidden in the Louis Vuitton bag, or in a Nike shoe box they were carrying out ",It's ok to be any colour. #AllLivesMatter,It's ok to be any colour. ,"the fact that some people think that their lives have more worth than others, make them the most worthless people of all. #AllLivesMatter","the fact that some people think that their lives have more worth than others, make them the most worthless people of all. "
12,You know what all these terrorists and muslims have in common? Nothing. Islam teaches us that life is sacred. #AllLivesMatter,You know what all these terrorists and muslims have in common? Nothing. Islam teaches us that life is sacred. ,These are the animals ‘protesting’ death of whatever the fuck his name was. #ALLLivesMatter,These are the animals ‘protesting’ death of whatever the fuck his name was. ,If one house burns to the ground not all houses matter at that moment! #AllLivesMatter,If one house burns to the ground not all houses matter at that moment! ,It would be so great if our country could just come together and treat everyone the same with equality. #AllLivesMatter,It would be so great if our country could just come together and treat everyone the same with equality. ,I hate that ALL of these goddamn emojis only come in fucking yellow. #alllivesmatter,I hate that ALL of these goddamn emojis only come in fucking yellow. ,Imagine been in the freest country in the world and feel oppressed 24/7. #AllLivesMatter,Imagine been in the freest country in the world and feel oppressed 24/7. ,They claim to not be Bigots/Racists but their very words and actions scream that they are just that Bigots/Racists. #AllLivesMatter,They claim to not be Bigots/Racists but their very words and actions scream that they are just that Bigots/Racists. ,I've been seeing people say if you dont see color you are the problem well I wanna say this. I dont see the color of people's skin I see the person's character and how they treat others. If I dont like you I guarantee it's because you aren't a good person. #AllLivesMatter,I've been seeing people say if you dont see color you are the problem well I wanna say this. I dont see the color of people's skin I see the person's character and how they treat others. If I dont like you I guarantee it's because you aren't a good person. ,"So sad people buy into race baiting and can’t simply love people for being human. My children see people for people, not objects based on skin color. #AllLivesMatter","So sad people buy into race baiting and can’t simply love people for being human. My children see people for people, not objects based on skin color. ","just wondering why everybody is getting mad at police for being racist and stereotypical, but in reality, saying that ALL police are racist and stereotypical is in fact, stereotypical. #AllLivesMatter","just wondering why everybody is getting mad at police for being racist and stereotypical, but in reality, saying that ALL police are racist and stereotypical is in fact, stereotypical. "
13,"Oh look, the ivory tower is showing its rather pale colors. #BlackLivesMatter","Oh look, the ivory tower is showing its rather pale colors. ",It terrifies me that if I respond out of fear and my lizard brain rather than from a place of love to know this is a possibility and this needs to change within myself as well as within the systemic issues. #BlackLivesMatter,It terrifies me that if I respond out of fear and my lizard brain rather than from a place of love to know this is a possibility and this needs to change within myself as well as within the systemic issues. ,Praying for Jacob Blake and disgusted by yet another police shooting of an unarmed human.  #BlackLivesMatter,Praying for Jacob Blake and disgusted by yet another police shooting of an unarmed human.  ,The world has become a strange place today. It is sad to see Humanity struggling to stay human. We can either sit in the fringe and pray or use our hands to create a better tomorrow. Hoping things will turn towards better one day. #BlackLivesMatter,The world has become a strange place today. It is sad to see Humanity struggling to stay human. We can either sit in the fringe and pray or use our hands to create a better tomorrow. Hoping things will turn towards better one day. ,"Will miss hockey tonight, but it’s for the right reason! #BlackLivesMatter","Will miss hockey tonight, but it’s for the right reason! ",I’m black EVERYDAY. Cops get off days. #BlackLivesMatter,I’m black EVERYDAY. Cops get off days. ,Praying for nothing but healing all over the U.S #BlackLivesMatter,Praying for nothing but healing all over the U.S ,WE HAVE A RIGHT TO DIGNITY #BLACKLIVESMATTER,WE HAVE A RIGHT TO DIGNITY ,Amazing what how one decision can redirect a life. #blacklivesmatter,Amazing what how one decision can redirect a life. ,When is this shit gone stop? Why are we targeted like this? #BlackLivesMatter,When is this shit gone stop? Why are we targeted like this? 
14,"I know people are exhausted from the past few days. Some perspective: that fear, the pit in your stomach, the tiredness and hopelessness you feel now, is how many black people feel their entire lives #BlackLivesMatter","I know people are exhausted from the past few days. Some perspective: that fear, the pit in your stomach, the tiredness and hopelessness you feel now, is how many black people feel their entire lives ",It’s time to retire the Mississippi state flag #blacklivesmatter,It’s time to retire the Mississippi state flag ,Law doesn't change anything unless the people do. #BlackLivesMatter,Law doesn't change anything unless the people do. ,Fuck the police. Fuck white supremacists. Juneteenth should be a national holiday. #Blacklivesmatter,Fuck the police. Fuck white supremacists. Juneteenth should be a national holiday. ,Sports can wait. #BlackLivesMatter,Sports can wait. ,Another black man killed like an animal by people who have pledged their lives to protect and serve. How many more have to die before our policing institution truly believe that all men are created equal #BlackLivesMatter,Another black man killed like an animal by people who have pledged their lives to protect and serve. How many more have to die before our policing institution truly believe that all men are created equal ,Respect to the Bucks and all NBA teams and players for their upcoming boycotts. Keep what is really important number one. Start again when it’s time. No rush to play basketball.. but we need to rush to equality. #BlackLivesMatter,Respect to the Bucks and all NBA teams and players for their upcoming boycotts. Keep what is really important number one. Start again when it’s time. No rush to play basketball.. but we need to rush to equality. ,If your a racist cunt please unfollow me cheers #BlackLivesMatter,If your a racist cunt please unfollow me cheers ,"When I was in elementary school I was always told that America was a place that valued equality, justice, peace, and freedom for all. How am I supposed to believe that when our own country is targeting people simply because of the color of their skin? #BlackLivesMatter","When I was in elementary school I was always told that America was a place that valued equality, justice, peace, and freedom for all. How am I supposed to believe that when our own country is targeting people simply because of the color of their skin? ","When is this going to stop. In Wisconsin, a black man was shot seven times and no weapon was even found that the police claimed he had. This is repulsive and disgusting behavior that is being exhibited by police officers towards African-Americans. #BlackLivesMatter","When is this going to stop. In Wisconsin, a black man was shot seven times and no weapon was even found that the police claimed he had. This is repulsive and disgusting behavior that is being exhibited by police officers towards African-Americans. "
15,"Also only a sick, racist sociopath would have their boot in the neck of a black man to begin with. #BlackLivesMatter","Also only a sick, racist sociopath would have their boot in the neck of a black man to begin with. ","I'm hearing that TikTok is anti-black, which makes me anti-TikTok. Fuck that shit. #BlackLivesMatter","I'm hearing that TikTok is anti-black, which makes me anti-TikTok. Fuck that shit. ","Can wrestling companies stop booking talent who use the n word? How do you expect black wrestlers to speak up, when you book these racists?  #BlacklivesMatter","Can wrestling companies stop booking talent who use the n word? How do you expect black wrestlers to speak up, when you book these racists?  ",Nah prison isn’t even cutting it for me. I want him to suffer black mirror white bear style punishment. All of these murdering police officers! #BlackLivesMatter,Nah prison isn’t even cutting it for me. I want him to suffer black mirror white bear style punishment. All of these murdering police officers! ,Arrest the police that shot Jacob Blake #BlackLivesMatter,Arrest the police that shot Jacob Blake ,"ITS NOT JUST POLICE, RACISM GOES SO DEEP THROUGH THE SYSTEM. SICKENING. #BlackLivesMatter","ITS NOT JUST POLICE, RACISM GOES SO DEEP THROUGH THE SYSTEM. SICKENING. ",Y’all gonna let people take knees now? #BlackLivesMatter,Y’all gonna let people take knees now? ,Please stop killing my people. #BlackLivesMatter,Please stop killing my people. ,This isn’t about right versus left. It’s about right versus wrong. Do what’s right...every time. #BlackLivesMatter,This isn’t about right versus left. It’s about right versus wrong. Do what’s right...every time. ,"People coming out in large numbers in support of a cause in the middle of a pandemic shows us that some things should be eradicated from the world even before the virus. End hatred, end prejudice, end racism. Speak up. #BlackLivesMatter","People coming out in large numbers in support of a cause in the middle of a pandemic shows us that some things should be eradicated from the world even before the virus. End hatred, end prejudice, end racism. Speak up. "
16,"For George Floyd, For Breonna Taylor, for everything not caught on camera. #BlackLivesMatter","For George Floyd, For Breonna Taylor, for everything not caught on camera. ",I'm Latino and I feel traumatized by all the evil actions against my Black brothers and sisters. I can only imagine the trauma Black folks go through having to see that hate ALL THE TIME. #BlackLivesMatter,I'm Latino and I feel traumatized by all the evil actions against my Black brothers and sisters. I can only imagine the trauma Black folks go through having to see that hate ALL THE TIME. ,There’s an ocean wide gap between being offended and being dead. #BlackLivesMatter,There’s an ocean wide gap between being offended and being dead. ,"whether you’re having tough conversations with your friends & family, or reading that book you ordered online, or fundraising/donating to organizations, or registering to vote (+ actually showing up to the polls!), just keep going. We still have a long way to go #BlackLivesMatter","whether you’re having tough conversations with your friends & family, or reading that book you ordered online, or fundraising/donating to organizations, or registering to vote (+ actually showing up to the polls!), just keep going. We still have a long way to go ",Love this NBA strike and the unity of the players to use their platform to demand justice.  #BlackLivesMatter,Love this NBA strike and the unity of the players to use their platform to demand justice.  ,i am absolutely so sick and tired of watching black man after black man die on camera.  when will our lives matter? when will my blackness not be viewed as a weapon? when will our lives truly matter? #BlackLivesMatter,i am absolutely so sick and tired of watching black man after black man die on camera.  when will our lives matter? when will my blackness not be viewed as a weapon? when will our lives truly matter? ,It’s disgusting that ‘till this day people are still being judged by the color of their skin. #blacklivesmatter,It’s disgusting that ‘till this day people are still being judged by the color of their skin. ,Listen louder #blacklivesmatter,Listen louder ,Salute the whole NBA right now... this is what you do when you are given such a big platform!! #BlackLivesMatter,Salute the whole NBA right now... this is what you do when you are given such a big platform!! ,I pray Jacob Blake recovers. Not another death. #BlackLivesMatter,I pray Jacob Blake recovers. Not another death. 
17,- We need action and WE NEED YOU TO HOLD EACH OTHER ACCOUNTABLE. Period. #BlackLivesMATTER,- We need action and WE NEED YOU TO HOLD EACH OTHER ACCOUNTABLE. Period. ,"If you're a teacher and reading this, introduce your students to Black authors! Black authors are American authors! #BlackLivesmatter","If you're a teacher and reading this, introduce your students to Black authors! Black authors are American authors! ","Lost my AirPods .. Support my GoFundMe for a new pair, any donation will be appreciated big or small #BlackLivesMatter","Lost my AirPods .. Support my GoFundMe for a new pair, any donation will be appreciated big or small ",silence is violence #BlackLivesMatter,silence is violence ,I've said it before and I'll keep saying it BOMBING BUILDINGS IS NOT PROTESTING; ITS TERRORISM #BlackLivesMatter,I've said it before and I'll keep saying it BOMBING BUILDINGS IS NOT PROTESTING; ITS TERRORISM ,I support the Bucks boycott #BlackLivesMatter,I support the Bucks boycott ,We are not a threat but only your own fear and worries which mirror  your own mindset. We are human as you are. #BlackLivesMatter,We are not a threat but only your own fear and worries which mirror  your own mindset. We are human as you are. ,"If you keep fighting our progress, you’re gonna be on the wrong side of history #BlackLivesMatter","If you keep fighting our progress, you’re gonna be on the wrong side of history ","Today’s decision over Breonna Taylor’s murder makes explicit as a legal principle that, in the eyes of the state, Black people are worth less than property. #BlackLivesMatter","Today’s decision over Breonna Taylor’s murder makes explicit as a legal principle that, in the eyes of the state, Black people are worth less than property. ",This needs to be a moment in history. #BlackLivesMatter,This needs to be a moment in history. 
18,"Happy (?) 142,566th Day of Black people being treated like sh*t in this country. Give or take a few days. But who's counting. #BlackLivesMatter","Happy (?) 142,566th Day of Black people being treated like sh*t in this country. Give or take a few days. But who's counting. ","When Trump says Americans should be able to walk the streets free of fear, he's referring, of course, only to white people...#BlackLivesMatter","When Trump says Americans should be able to walk the streets free of fear, he's referring, of course, only to white people...",Black folks are getting the cops called on them for *napping* now #BlackLivesMatter,Black folks are getting the cops called on them for *napping* now ,History has its knee on the neck of white supremacy.                                     #BlackLivesMatter,History has its knee on the neck of white supremacy.                                     ,"First George Floyd, then Breonna Taylor, and now Jacob Blake. Enough is enough. #BlackLivesMatter","First George Floyd, then Breonna Taylor, and now Jacob Blake. Enough is enough. ",Continuously support us and the black community #BlackLivesMatter,Continuously support us and the black community ,2020 would be so much more bearable if cops would stop shooting Black people. #Blacklivesmatter,2020 would be so much more bearable if cops would stop shooting Black people. ,The reason supporters of Puerto Rico Statehood are racist is in fact that they support statehood because they believe the islands have too many black people (themselves included) to possibly be successful  at governing themselves. #BlackLivesMatter,The reason supporters of Puerto Rico Statehood are racist is in fact that they support statehood because they believe the islands have too many black people (themselves included) to possibly be successful  at governing themselves. ,people cannot be excluded only because of their skin color! #BlackLivesMatter,people cannot be excluded only because of their skin color! ,The black community know cops r needed 2 keep communities safe. What they're trying 2 convey is that rogue cops using their uniform 2 carry out their hatred against POC ISNT whats needed. They want the police dept 2 clean out their precincts of rogue cops. #BlackLivesMatter,The black community know cops r needed 2 keep communities safe. What they're trying 2 convey is that rogue cops using their uniform 2 carry out their hatred against POC ISNT whats needed. They want the police dept 2 clean out their precincts of rogue cops. 
